{
   "format": "papier",
   "series": "Biblioteka Jednoro\u017cca",
   "publisher": "Pa\u0144stwowy Instytut Wydawniczy",
   "publishYear": "1971-01-01",
   "pages": "94",
   "language": "polski",
   "author": "J\u00f3zsef Lengyel",
   "description": "Ta ksi\u0105\u017cka nie posiada jeszcze opisu.",
   "title": "Czarownik",
	"genre": "proza"
}
