{
   "isbn": null,
   "title": "ksi\u0105\u017cka 7",
   "publishYear": null,
   "firstPublishYear": null,
   "format": "unknown",
   "pages": null,
   "description": "",
   "notes": "",
   "originalTitle": "",
   "translator": "",
   "language": "",
   "genre": [
      {
         "id": 4,
         "title": "komiks",
         "isCustom": false
      },
      {
         "id": null,
         "title": "diatry by",
         "isCustom": true
      }
   ]
}