{
   "isbn": null,
   "title": "ksi\u0105\u017cka 3",
   "publishYear": null,
   "firstPublishYear": null,
   "format": "unknown",
   "pages": null,
   "description": "",
   "notes": "",
   "originalTitle": "",
   "translator": "",
   "language": "",
   "author": [
      {
         "id": 2,
         "title": "Pawe\u0142 Pompa",
         "isCustom": false
      },
      {
         "id": null,
         "title": "Ma\u0142a Kurka",
         "isCustom": true
      }
   ]
}