{
   "isbn": null,
   "title": "ksi\u0105\u017cka 13",
   "publishYear": null,
   "firstPublishYear": null,
   "format": "unknown",
   "pages": null,
   "description": "",
   "notes": "Poranek. Mg\u0142a otula pola, s\u0142o\u0144ce walczy z cieniem. Wiatr ta\u0144czy w koronach drzew, nios\u0105c zapach \u015bwie\u017cego chleba. Kot przeci\u0105ga si\u0119 leniwie na ganku. Cisza. Tylko komar brz\u0119czy uparcie nad uchem...",
   "originalTitle": "",
   "translator": "",
   "language": ""
}