{
   "isbn": null,
   "title": "ksi\u0105\u017cka 14",
   "publishYear": null,
   "firstPublishYear": null,
   "format": "unknown",
   "pages": null,
   "description": "",
   "notes": "",
   "originalTitle": "",
   "translator": "",
   "language": "",
   "series": {
      "id": null,
      "title": "szaraczki",
      "isCustom": true
   }
}