{
   "format": "papier",
   "series": "Biblioteka Jednoro\u017cca",
   "originalTitle": "Lettres portugases",
   "publisher": "Pa\u0144stwowy Instytut Wydawniczy",
   "publishYear": "1959-01-01",
   "pages": "68",
   "language": "polski",
   "translator": "Stanis\u0142aw Przybyszewski",
   "author": "Mariana Alcoforado",
   "description": "Ta ksi\u0105\u017cka nie posiada jeszcze opisu.",
   "title": "Listy mi\u0142osne",
	"genre": "proza"
}
