{
   "format": "papier",
   "series": "Biblioteka Jednoro\u017cca",
   "originalTitle": "Jerikos fall, Liten kvinna - m\u00e5nga barn, Mannen som ville bli Gud",
   "publisher": "Pa\u0144stwowy Instytut Wydawniczy",
   "publishYear": "1964-01-01",
   "pages": "84",
   "language": "polski",
   "translator": "Zygmunt \u0141anowski",
   "author": "Artur Lundkvist",
   "description": "Opowiadania wybra\u0142 i prze\u0142o\u017cy\u0142 Zygmunt \u0141anowski (\"Upadek Jerycha\", \"Ma\u0142a kobietka, du\u017co dzieci\", \"Cz\u0142owiek, kt\u00f3ry chcia\u0142 by\u0107 Bogiem\").",
   "title": "Upadek Jerycha",
	"genre": "proza"
}
