{
   "isbn": null,
   "title": "ksi\u0105\u017cka 11",
   "publishYear": null,
   "firstPublishYear": null,
   "format": "unknown",
   "pages": null,
   "description": "S\u0142o\u0144ce leniwie wznosi\u0142o si\u0119 nad mglistymi \u0142\u0105kami, roz\u015bwietlaj\u0105c krople rosy jak drobne diamenty. Wiatr szele\u015bci\u0142 w koronach starych d\u0119b\u00f3w, nios\u0105c zapach wilgotnej ziemi i dojrzewaj\u0105cych malin. Gdzie\u015b w oddali kowalik puka\u0142 w kor\u0119 sosny, szukaj\u0105c smakowitych larw. Poranna kawa parzy\u0142a si\u0119 w tykwie, roznosz\u0105c gorzk\u0105, pobudzaj\u0105c\u0105 wo\u0144. W taki dzie\u0144 nawet zwyk\u0142a droga do miasteczka zdawa\u0142a si\u0119 przygod\u0105. Mijane pola \u017cyta ko\u0142ysa\u0142y si\u0119 w rytm niewidzialnej melodii, a jask\u00f3\u0142ki \u015bmiga\u0142y tu\u017c nad traw\u0105, poluj\u0105c na nieostro\u017cne muszki. Stary traktor, pami\u0119taj\u0105cy zapewne lepsze czasy, sta\u0142 zapomniany w cieniu szopy, obro\u015bni\u0119ty powojem. Cisz\u0119 przerywa\u0142 tylko terkot zrz\u0119dliwej sroki, kt\u00f3ra obra\u0142a sobie za punkt obserwacyjny przydro\u017cny s\u0142up. \"Czas jest tylko z\u0142udzeniem\", mawia\u0142 dziadek, patrz\u0105c na powolny bieg chmur. Ciep\u0142y kamie\u0144 w kieszeni spodni przypomina\u0142 o znalezisku sprzed tygodnia \u2013 mo\u017ce to by\u0142 zwyk\u0142y otoczak, a mo\u017ce skamienia\u0142e serce jakiego\u015b pradawnego stworzenia? W spi\u017carni cicho pracowa\u0142y s\u0142oiki z kiszonkami, czekaj\u0105c na zimowe wieczory. A czasem...",
   "notes": "",
   "originalTitle": "",
   "translator": "",
   "language": ""
}