{
    "isbn": 9788395159046,
    "title": "Łkające ryby",
    "author": "Ziijan Chi",
    "publishYear": 2019,
    "firstPublishYear": 2019,
    "format": "paperback",
    "publisher": "Kwiaty Orientu",
    "pages": 192,
    "description": "\u0141kaj\u0105ce ryby i inne opowiadania Chi Ziijan to zbi\u00f3r barwnych opowiada\u0144 powsta\u0142ych w r\u00f3\u017cnych porach roku. Pe\u0142ne przenikliwo\u015bci opisy przyrody i zmian w niej zachodz\u0105cych s\u0105 sta\u0142ym elementem opowiada\u0144 pisarki. Kipi\u0105 one od barw, d\u017awi\u0119k\u00f3w i zapach\u00f3w, a zestrojona z przedstawion\u0105 histori\u0105 przyroda wsp\u00f3\u0142tworzy niezwyk\u0142y nastr\u00f3j opowie\u015bci. Dzi\u0119ki takim technikom obrazowania opowiadania zyskuj\u0105 niezwyk\u0142\u0105 nastrojowo\u015b\u0107. Historie Chi Zijian w tym ziorze opisuj\u0105 pi\u0119kny, wzruszaj\u0105cy \u015bwiat, ca\u0142kiem odmienny od naszego, kt\u00f3ry warto przybli\u017cy\u0107 polskiemu czytelnikowi, u\u015bwiadamiaj\u0105c mu, jak ogromnym i r\u00f3\u017cnorodnym krajem s\u0105 Chiny \u2013 i jak bardzo zr\u00f3\u017cnicowani s\u0105 ich mieszka\u0144cy. Urodzona w 1964 roku Chi Zijian (oryg. \u8fdf\u5b50\u5efa) jest chi\u0144sk\u0105 pisark\u0105 pochodz\u0105c\u0105 z powiatu Mohe, po\u0142o\u017conego w prowincji Heilongjiang, najbardziej na p\u00f3\u0142noc wysuni\u0119tego punktu Pa\u0144stwa \u015arodka, po\u0142o\u017conego tu\u017c przy granicy z Rosj\u0105. Chi Ziijan jest jedn\u0105 z najbardziej znanych pisarek m\u0142odego pokolenia. Jej dzie\u0142a przet\u0142umaczono na wiele j\u0119zyk\u00f3w. \u0141kaj\u0105ce ryby i inne opowiadania to pierwsze dzie\u0142o pisarki wydane w Polsce.",
    "notes": "Zbiór opowiadań",
    "series": "Orient",
    "originalTitle": "kk",
    "translator": "Magdalena Stoszek-Deng",
    "language": "pl_"
}
