{
   "format": "papier",
   "series": "Biblioteka Jednoro\u017cca",
   "publisher": "Pa\u0144stwowy Instytut Wydawniczy",
   "publishYear": "1969-01-01",
   "pages": "100",
   "language": "polski",
   "author": "Stanis\u0142aw Zieli\u0144ski",
   "description": "Ta ksi\u0105\u017cka nie posiada jeszcze opisu.",
   "title": "Sny pod Fumarol\u0105",
	"genre": "proza"
}
