{
   "isbn": null,
   "title": "ksi\u0105\u017cka 4",
   "publishYear": null,
   "firstPublishYear": null,
   "format": "unknown",
   "pages": null,
   "description": "",
   "notes": "",
   "originalTitle": "",
   "translator": "",
   "language": "",
   "publisher": [
      {
         "id": null,
         "title": "bia\u0142e kawki",
         "isCustom": true
      }
   ]
}